{
  "$schema": "https://json-schema.org/draft/2020-12/schema",
  "$id": "generated/schemas/chatgpt-pipeline/packet/scm.pattern.binding.schema.json",
  "title": "ChatGPT scm.pattern binding",
  "description": "Local realization binding for the adopted scm.pattern route.",
  "type": "object",
  "required": [
    "artifact_type",
    "artifact_version",
    "packet_id",
    "workflow_state",
    "review_state",
    "surface",
    "authority_manifest_ref",
    "realization_scope",
    "human_intervention_points",
    "promotion_constraints",
    "repo_relative_packet_root",
    "notes"
  ],
  "properties": {
    "artifact_type": {
      "const": "gpt_handoff.scm_pattern.binding"
    },
    "artifact_version": {
      "type": "string"
    },
    "packet_id": {
      "type": "string"
    },
    "workflow_state": {
      "type": "string"
    },
    "review_state": {
      "type": "string"
    },
    "surface": {
      "type": "string"
    },
    "authority_manifest_ref": {
      "type": "string"
    },
    "authority_manifest_schema_ref": {
      "type": "string"
    },
    "kernel_trust": {
      "type": "object",
      "required": [
        "root_trust_evidence_ref",
        "root_signers_ref",
        "root_delegation_ref",
        "authority_manifest_validation_ref",
        "authority_manifest_signature_ref"
      ],
      "properties": {
        "root_trust_evidence_ref": { "type": "string" },
        "root_signers_ref": { "type": "string" },
        "root_delegation_ref": { "type": "string" },
        "authority_manifest_validation_ref": { "type": "string" },
        "authority_manifest_signature_ref": { "type": "string" }
      },
      "additionalProperties": false
    },
    "realization_scope": {
      "type": "object",
      "required": [
        "write_paths",
        "conditional_write_paths",
        "read_paths"
      ],
      "properties": {
        "write_paths": {
          "type": "array",
          "items": { "type": "string" }
        },
        "conditional_write_paths": {
          "type": "array",
          "items": { "type": "string" }
        },
        "read_paths": {
          "type": "array",
          "items": { "type": "string" }
        }
      },
      "additionalProperties": false
    },
    "human_intervention_points": {
      "type": "array",
      "items": {
        "type": "string"
      }
    },
    "promotion_constraints": {
      "type": "array",
      "items": {
        "type": "string"
      }
    },
    "repo_relative_packet_root": {
      "type": "string"
    },
    "notes": {
      "type": "string"
    }
  },
  "additionalProperties": false
}
